[
  {
    "id": "CL2.1",
    "clause_id": "CL2",
    "field": "registration_class",
    "op": "in",
    "value": [
      "Class-A"
    ],
    "source_text": "Only contractors registered in Class-A are eligible to bid."
  },
  {
    "id": "CL3.1",
    "clause_id": "CL3",
    "field": "turnover_cr",
    "op": ">=",
    "value": 100,
    "source_text": "The bidder must have an annual turnover of at least ₹100 crore."
  },
  {
    "id": "CL4.1",
    "clause_id": "CL4",
    "field": "years_experience",
    "op": ">=",
    "value": 15,
    "source_text": "The bidder must have at least 15 years of experience in the construction of similar buildings."
  },
  {
    "id": "CL5.1",
    "clause_id": "CL5",
    "field": "bid_days",
    "op": "==",
    "value": 7,
    "source_text": "Bids must be submitted within 7 days from the date of publication of this notice."
  },
  {
    "id": "CL6.1",
    "clause_id": "CL6",
    "field": "emd_pct",
    "op": "==",
    "value": 2,
    "source_text": "An Earnest Money Deposit of 2% of the estimated contract value must accompany the bid."
  }
]
