[
  {
    "id": "CL2.1",
    "clause_id": "CL2",
    "field": "registration_class",
    "op": "in",
    "value": [
      "Class-A",
      "Class-B",
      "Class-C"
    ],
    "source_text": "Contractors registered in Class-A, Class-B or Class-C are eligible to bid."
  },
  {
    "id": "CL3.1",
    "clause_id": "CL3",
    "field": "turnover_cr",
    "op": ">=",
    "value": 5,
    "source_text": "The bidder must have an annual turnover of at least ₹5 crore."
  },
  {
    "id": "CL4.1",
    "clause_id": "CL4",
    "field": "years_experience",
    "op": ">=",
    "value": 3,
    "source_text": "The bidder must have at least 3 years of experience in building maintenance works."
  },
  {
    "id": "CL5.1",
    "clause_id": "CL5",
    "field": "bid_days",
    "op": "==",
    "value": 30,
    "source_text": "Bids must be submitted within 30 days from the date of publication of this notice."
  },
  {
    "id": "CL6.1",
    "clause_id": "CL6",
    "field": "emd_pct",
    "op": "==",
    "value": 2,
    "source_text": "An Earnest Money Deposit of 2% of the estimated contract value must accompany the bid."
  }
]
